{
  "schema": "cac.rfc_doc.v1",
  "schema_version": "1.0.0",
  "kind": "rfc.document",
  "meta": {
    "id": "RFC-0033",
    "title": "Ledger + CAS + Daemon Persistence Contract",
    "stable_id": "dcp://apm2.dev/rfc/RFC-0033",
    "labels": [
      "ledger",
      "cas",
      "persistence",
      "truth_plane",
      "append_only",
      "hash_chain",
      "signatures",
      "migration",
      "no_dual_impl",
      "lifecycle:LIVING",
      "spine"
    ],
    "relationships": [
      {
        "kind": "SUPERSEDES",
        "ref": "documents/rfcs/RFC-0001",
        "note": "Replaces legacy kernel architecture RFC for persistence semantics; aligns to current apm2-daemon + apm2-core ledger implementation."
      },
      {
        "kind": "SUPERSEDES",
        "ref": "documents/rfcs/RFC-0018 (HEF Phase 1)",
        "note": "Absorbs persistence-related semantics (ledger/CAS) into a single truth-plane RFC; HEF becomes a derived FAC concern."
      },
      {
        "kind": "DEPENDS_ON",
        "ref": "dcp://apm2.dev/rfc/RFC-0016",
        "note": "LedgerTime and time envelopes follow HTF authority model."
      },
      {
        "kind": "AFFECTS",
        "ref": "dcp://apm2.dev/rfc/RFC-0032",
        "note": "FAC uses ledger/CAS for work events, evidence, receipts."
      }
    ],
    "provenance": {
      "actor_id": "APM2-DOC-GOV",
      "work_id": "RFC-0033",
      "notes": "New spine RFC consolidating ledger+CAS semantics and migration guards based on current implementation."
    }
  },
  "payload": {
    "root": {
      "type": "rfc",
      "title": "RFC-0033: Ledger + CAS + Daemon Persistence Contract",
      "children": [
        {
          "type": "section",
          "title": "0. Scope and authority boundaries",
          "children": [],
          "data": {
            "heading_level": 2
          },
          "body": "This RFC specifies the **authoritative persistence substrate** for APM2:\n\n* **CAS** — durable content-addressed storage for arbitrary bytes (evidence, CAC artifacts, bundles).\n* **Ledger** — append-only, hash-chained, signed event log that references CAS objects and provides LedgerTime ordering.\n* **Daemon persistence contract** — the daemon is the sole writer; startup must validate schema/migration and enforce no dual-truth planes.\n\nThis RFC is the truth-plane foundation used by:\n* CAC admission and DCP index (RFC-0011),\n* HSI receipts and authority seals (RFC-0020),\n* FAC event fabric and admission gating (RFC-0032),\n* HTF LedgerTime semantics (RFC-0016).\n"
        },
        {
          "type": "section",
          "title": "1. Content-addressed storage (CAS)",
          "children": [
            {
              "type": "requirement",
              "id": "RFC-0033::REQ-0001",
              "title": "CAS uses BLAKE3 content addressing with hash verification",
              "children": [],
              "data": {
                "level": "MUST",
                "statement": "The Content-Addressed Storage (CAS) subsystem MUST address objects by the BLAKE3 hash of their exact bytes. CAS MUST verify that any stored or retrieved bytes match their claimed hash.",
                "acceptance": [
                  "CAS put computes BLAKE3(bytes) and returns the lowercase hex digest (64 chars) as the object key.",
                  "CAS get verifies that BLAKE3(retrieved_bytes) == requested hash before returning to caller.",
                  "CAS rejects invalid hash strings (non-hex or wrong length) before attempting filesystem access."
                ],
                "rationale": "Hash verification is the integrity boundary for all evidence and control artifacts.",
                "domain": [
                  "security",
                  "correctness",
                  "storage"
                ],
                "edge_cases": [
                  "If hash verification fails, the object is treated as corrupted; CAS returns an integrity error and MAY quarantine the on-disk blob.",
                  "If the filesystem returns fewer bytes than expected (short read), treat as corruption and fail closed."
                ],
                "fail_closed": "Never return bytes that do not verify to the requested hash.",
                "code_refs": [
                  "crates/apm2-daemon/src/cas/mod.rs",
                  "crates/apm2-core/src/crypto/hash.rs"
                ],
                "theory_refs": [
                  "INV-F-01",
                  "INV-F-03",
                  "INV-F-05"
                ]
              },
              "body": ""
            },
            {
              "type": "requirement",
              "id": "RFC-0033::REQ-0002",
              "title": "CAS filesystem safety: no symlinks, no traversal, locked-down permissions",
              "children": [],
              "data": {
                "level": "MUST",
                "statement": "CAS storage MUST be safe against path traversal and symlink attacks. All CAS directories MUST be created with restrictive permissions (0700) and must reject symlink components.",
                "acceptance": [
                  "CAS init creates `objects/` and `metadata/` with 0700 (owner-only) permissions.",
                  "CAS rejects any resolved path containing symlinks or non-canonical components.",
                  "CAS enforces that all writes occur under the configured root directory and never follow symlinks."
                ],
                "rationale": "CAS stores authoritative evidence; symlink/traversal vulnerabilities are integrity and privilege-escalation risks.",
                "domain": [
                  "security",
                  "storage"
                ],
                "edge_cases": [
                  "If the CAS root is not a directory or has unsafe permissions, daemon startup fails.",
                  "If existing directories have broader permissions, startup fails or tightens them under policy."
                ],
                "fail_closed": "Refuse to initialize CAS if safety checks fail.",
                "code_refs": [
                  "crates/apm2-daemon/src/cas/mod.rs",
                  "crates/apm2-daemon/src/fs_safe.rs"
                ],
                "theory_refs": [
                  "INV-F-05"
                ]
              },
              "body": ""
            },
            {
              "type": "requirement",
              "id": "RFC-0033::REQ-0003",
              "title": "CAS writes are atomic and crash-consistent",
              "children": [],
              "data": {
                "level": "MUST",
                "statement": "CAS writes MUST be atomic: a put operation either makes the full object visible at its final path or not at all. Partial writes MUST not become visible as valid objects.",
                "acceptance": [
                  "CAS writes to a unique temp file in `objects/.tmp/` and atomically renames to final object path.",
                  "Temp files are fsynced (or equivalent) before rename under durability policy.",
                  "If a crash occurs mid-write, recovery process removes temp files and does not treat them as objects."
                ],
                "rationale": "Atomicity is required to keep content hashes meaningful and to preserve ledger referential integrity.",
                "domain": [
                  "correctness",
                  "reliability",
                  "storage"
                ],
                "edge_cases": [
                  "If rename fails due to cross-device boundaries, CAS rejects configuration (root must be single filesystem).",
                  "Concurrent writes of the same hash are allowed; exactly one final object may exist and its bytes must verify."
                ],
                "fail_closed": "On any I/O or atomicity uncertainty, treat operation as failed and do not emit a reference to the object.",
                "code_refs": [
                  "crates/apm2-daemon/src/cas/mod.rs"
                ],
                "theory_refs": [
                  "INV-F-01",
                  "INV-F-05"
                ]
              },
              "body": ""
            },
            {
              "type": "requirement",
              "id": "RFC-0033::REQ-0004",
              "title": "CAS enforces per-object and total size limits",
              "children": [],
              "data": {
                "level": "MUST",
                "statement": "CAS MUST enforce a maximum object size and a maximum total store size, and MUST fail closed when limits would be exceeded.",
                "acceptance": [
                  "CAS rejects put operations where bytes_len > max_object_size_bytes.",
                  "CAS maintains a persistent total_size counter and rejects put operations that would exceed max_total_size_bytes.",
                  "Size accounting is crash-consistent and monotone with respect to successful puts."
                ],
                "rationale": "Prevents unbounded disk consumption and ensures predictable resource envelopes for admission and evidence publication.",
                "domain": [
                  "security",
                  "reliability",
                  "storage"
                ],
                "edge_cases": [
                  "If total_size metadata is missing or corrupted, CAS recomputes total size by scanning objects, then persists corrected metadata.",
                  "If disk is full mid-write, CAS aborts and cleans up temp files; total_size must not be incremented."
                ],
                "fail_closed": "Reject writes that exceed limits; do not attempt partial eviction unless explicitly configured.",
                "code_refs": [
                  "crates/apm2-daemon/src/cas/mod.rs"
                ],
                "theory_refs": [
                  "INV-F-05"
                ]
              },
              "body": ""
            },
            {
              "type": "requirement",